cuce,entidad,tipo_de_contratacion,modalidad,objeto_de_contratacion,subasta,fecha_publicacion,fecha_presentacion,estado,persona_contacto,fecha_adjudicacion_desierta,departamento,normativa
25-0548-00-1593419-0-E,Cofadena Oficina Central,Bienes,CD,Adquisición De Combustible Para El Abastecimiento De Diésel Y Gasolina Para El Proyecto “Mejoramiento De Accesos Viales Y Conformación De Plataformas Para Accesos Principales”,False,2026-01-01,,Contratado,Janeth Jamillo Perez (Telf: 2433810),,La Paz,NB-SABS (D.S.0181)
25-1541-00-1624206-1-1,Gobierno Autonomo Municipal San Pedro De Macha,Consultoria,ANPE,Consultores En Linea - Medicos Y Para Medicos Red De Salud San Pedro De Macha (Gestion 2026),False,2026-01-02,2026-01-08,Vigente,Ambrosio Chumacero Yucra (Telf: 72407888),,Potosi,NB-SABS (D.S.0181)
25-1541-00-1624235-1-1,Gobierno Autonomo Municipal San Pedro De Macha,Consultoria,ANPP,Fortalecimiento A La Salud (Consultores Individuales De Linea Gestion 2026),False,2026-01-02,2026-01-13,Vigente,Ambrosio Chumacero Yucra (Telf: 72407888),,Potosi,NB-SABS (D.S.0181)
24-1431-00-1623533-0-E,Gobierno Autonomo Municipal De Sabaya,Bienes,EX,Adquisición De Insumos Para La Alimentación Complementaria Escolar ( Declarados Desiertos Cnc Arroz Y Carne),False,2026-01-04,,Contratado,Nilda Cussi Colque (Telf: 25134116),,Oruro,NB-SABS (D.S.0181)
25-3701-00-1624666-0-E,Gaioc De Charagua Iyambae,Consultoria,CM,Medico Pediatra Para El Centro De Salud Integral Mamerto Eguez Soruco,False,2026-01-04,,Contratado,Jose Domingo Pedraza Alcantara (Telf: 73320206),,Santa Cruz,NB-SABS (D.S.0181)
25-3701-00-1624667-0-E,Gaioc De Charagua Iyambae,Consultoria,CM,Medico General V Para El Centro De Salud Integral Mamerto Eguez Soruco,False,2026-01-04,,Contratado,Jose Domingo Pedraza Alcantara (Telf: 73320206),,Santa Cruz,NB-SABS (D.S.0181)
