cuce,entidad,tipo_de_contratacion,modalidad,objeto_de_contratacion,subasta,fecha_publicacion,fecha_presentacion,estado,persona_contacto,fecha_adjudicacion_desierta,departamento,normativa
25-0670-00-1628515-0-E,Organo Electoral Plurinacional,Bienes,CD,"Adquisicion De Lectores Internos Mouse Y Teclados Para Equipos Estacionarios, Elecciones Subnacionales 2026 Del Servicio De Registro Civico De La Paz",False,2026-02-01,,Contratado,Jhonny Reynaldo Quenta Chavez (Telf: 2424221 - 2410545),,La Paz,Ley 1700 Elecciones Subnacionales 2026
26-1279-00-1628068-1-1,Gobierno Autonomo Municipal De Jesus De Machaca,Bienes,ANPP,"Provision De Alimentacion Complementaria Escolar (Adquisicion De Alimentacion Complementaria Escolar En Racion Liquida, Solida Y Fruta Para Estudiantes De Las Unidades Educativas Del Gam Jesus De Machaca 2026)",True,2026-02-01,2026-02-10,Vigente,Eva Yujra Ticona (Telf: 71556784),,La Paz,NB-SABS (D.S.0181)
26-1279-00-1628514-1-1,Gobierno Autonomo Municipal De Jesus De Machaca,Bienes,ANPP,"Provision De Alimentacion Complementaria Escolar (Adquisicion De Productos De Racion Seca, Hortalizas, Carne Y Huevo Para La Alimentacion Complementaria Escolar De Estudiantes De Las Unidades Educativas Del Gam Jesus De Machaca I - 2026)",True,2026-02-01,2026-02-10,Vigente,Eva Yujra Ticona (Telf: 71556784),,La Paz,NB-SABS (D.S.0181)
26-1327-00-1627982-1-1,Gobierno Autonomo Municipal De Capinota,Bienes,ANPP,Compra De Reactivos E Insumos Primer Semestre,True,2026-02-01,2026-02-12,Vigente,Noe Zenteno Arce (Telf: 4389007- 4388331),,Cochabamba,NB-SABS (D.S.0181)
26-1327-00-1628482-1-1,Gobierno Autonomo Municipal De Capinota,Bienes,CM,Compra De Alimentación Complementaria Escolar Ración Fruta (Banano Tipo Exportación) Área Concentrada Mes De Febrero,False,2026-02-01,2026-02-04,Vigente,Noe Zenteno Arce (Telf: 4389007- 4388331),,Cochabamba,NB-SABS (D.S.0181)
26-1327-00-1628512-1-1,Gobierno Autonomo Municipal De Capinota,Bienes,CM,Compra De Alimentación Complementaria Escolar Ración Liquida Mes De Febrero,False,2026-02-01,2026-02-04,Vigente,Noe Zenteno Arce (Telf: 4389007- 4388331),,Cochabamba,NB-SABS (D.S.0181)
26-1424-00-1628511-1-1,Gobierno Autonomo Municipal De Andamarca (Santiago De Andamarca),Bienes,CM,Adquisición De Alimentación Complementaria Escolar - Alimentos Frescos (Verduras Y Frutas) Para Las Diferentes Unidades Educativas Del Municipio De Santiago De Andamarca,False,2026-02-01,2026-02-04,Vigente,Cristo Nina Aymaya (Telf: 71856641),,Oruro,NB-SABS (D.S.0181)
26-1530-00-1628516-1-1,Gobierno Autonomo Municipal De Uyuni,Bienes,CND1,Adquisición De Ropa De Trabajo Para El Personal De La Planta De Prefabricados De Hormigon Del Gobierno Autónomo Municipal De Uyuni,False,2026-02-01,2026-02-06,Vigente,Ximena Calle Casilla (Telf: 2-6933195 - 73896555),,Potosi,Compro Hecho en Bolivia (D.S.4505)
